packages/kestrel-kernels/kestrel_kernels-0.1.0-cp313-cp313-manylinux_2_34_x86_64.whl/kestrel_kernels/configs/cute_moe_E64_H2048_I1024_bf16_sm90.json
{
  "description": "CuTe MoE kernel configs optimized for H100 (SM90)",
  "up": {
    "1": {
      "block_m": 16,
      "block_n": 128,
      "block_k": 128,
      "num_warps": 8,
      "num_stages": 3,
      "kernel_type": "warp",
      "time_us": 28.8
    },
    "2": {
      "block_m": 16,
      "block_n": 64,
      "block_k": 256,
      "num_warps": 2,
      "num_stages": 2,
      "kernel_type": "warp",
      "time_us": 49.5
    },
    "4": {
      "block_m": 16,
      "block_n": 64,
      "block_k": 128,
      "num_warps": 2,
      "num_stages": 1,
      "kernel_type": "warp",
      "time_us": 88.8
    },
    "8": {
      "block_m": 16,
      "block_n": 32,
      "block_k": 256,
      "num_warps": 2,
      "num_stages": 2,
      "kernel_type": "warp",
      "time_us": 123.2
    },
    "16": {
      "block_m": 16,
      "block_n": 32,
      "block_k": 256,
      "num_warps": 2,
      "num_stages": 2,
      "kernel_type": "warp",
      "time_us": 161.3
    },
    "24": {
      "block_m": 16,
      "block_n": 256,
      "block_k": 128,
      "num_warps": 8,
      "num_stages": 2,
      "kernel_type": "warp",
      "time_us": 180.3
    },
    "32": {
      "block_m": 16,
      "block_n": 256,
      "block_k": 128,
      "num_warps": 4,
      "num_stages": 2,
      "kernel_type": "warp",
      "time_us": 186.7
    },
    "48": {
      "block_m": 16,
      "block_n": 128,
      "block_k": 128,
      "num_warps": 4,
      "num_stages": 4,
      "kernel_type": "warp",
      "time_us": 189.9
    },
    "64": {
      "block_m": 16,
      "block_n": 128,
      "block_k": 128,
      "num_warps": 8,
      "num_stages": 4,
      "kernel_type": "warp",
      "time_us": 190.6
    },
    "96": {
      "block_m": 16,
      "block_n": 128,
      "block_k": 128,
      "num_warps": 8,
      "num_stages": 4,
      "kernel_type": "warp",
      "time_us": 193.1
    },
    "128": {
      "block_m": 32,
      "block_n": 128,
      "block_k": 128,
      "num_warps": 4,
      "num_stages": 2,
      "kernel_type": "warp",
      "time_us": 194.4
    },
    "256": {
      "block_m": 64,
      "block_n": 256,
      "block_k": 128,
      "num_warps": 8,
      "num_stages": 1,
      "kernel_type": "warp",
      "time_us": 199.3
    },
    "512": {
      "block_m": 64,
      "block_n": 256,
      "block_k": 128,
      "num_warps": 4,
      "num_stages": 1,
      "kernel_type": "warp",
      "time_us": 214.9
    },
    "1024": {
      "block_m": 128,
      "block_n": 256,
      "block_k": 128,
      "num_warps": 8,
      "num_stages": 2,
      "kernel_type": "wgmma",
      "time_us": 261.0
    },
    "1536": {
      "block_m": 128,
      "block_n": 256,
      "block_k": 64,
      "num_warps": 8,
      "num_stages": 3,
      "kernel_type": "wgmma",
      "time_us": 302.2
    },
    "2048": {
      "block_m": 128,
      "block_n": 256,
      "block_k": 64,
      "num_warps": 8,
      "num_stages": 3,
      "kernel_type": "wgmma",
      "time_us": 358.0
    },
    "3072": {
      "block_m": 128,
      "block_n": 256,
      "block_k": 64,
      "num_warps": 8,
      "num_stages": 3,
      "kernel_type": "wgmma",
      "time_us": 487.3
    },
    "4096": {
      "block_m": 128,
      "block_n": 256,
      "block_k": 64,
      "num_warps": 8,
      "num_stages": 3,
      "kernel_type": "wgmma",
      "time_us": 593.9
    }
  },
  "down": {
    "1": {
      "block_m": 16,
      "block_n": 128,
      "block_k": 128,
      "num_warps": 4,
      "num_stages": 4,
      "kernel_type": "warp",
      "time_us": 15.5
    },
    "2": {
      "block_m": 16,
      "block_n": 256,
      "block_k": 128,
      "num_warps": 4,
      "num_stages": 2,
      "kernel_type": "warp",
      "time_us": 30.5
    },
    "4": {
      "block_m": 16,
      "block_n": 64,
      "block_k": 128,
      "num_warps": 2,
      "num_stages": 2,
      "kernel_type": "warp",
      "time_us": 49.5
    },
    "8": {
      "block_m": 16,
      "block_n": 32,
      "block_k": 128,
      "num_warps": 2,
      "num_stages": 2,
      "kernel_type": "warp",
      "time_us": 67.6
    },
    "16": {
      "block_m": 16,
      "block_n": 64,
      "block_k": 256,
      "num_warps": 4,
      "num_stages": 1,
      "kernel_type": "warp",
      "time_us": 86.8
    },
    "24": {
      "block_m": 16,
      "block_n": 32,
      "block_k": 256,
      "num_warps": 2,
      "num_stages": 1,
      "kernel_type": "warp",
      "time_us": 96.3
    },
    "32": {
      "block_m": 16,
      "block_n": 32,
      "block_k": 256,
      "num_warps": 2,
      "num_stages": 3,
      "kernel_type": "warp",
      "time_us": 99.6
    },
    "48": {
      "block_m": 16,
      "block_n": 32,
      "block_k": 128,
      "num_warps": 2,
      "num_stages": 1,
      "kernel_type": "warp",
      "time_us": 102.0
    },
    "64": {
      "block_m": 16,
      "block_n": 32,
      "block_k": 256,
      "num_warps": 2,
      "num_stages": 3,
      "kernel_type": "warp",
      "time_us": 102.4
    },
    "96": {
      "block_m": 16,
      "block_n": 64,
      "block_k": 128,
      "num_warps": 2,
      "num_stages": 2,
      "kernel_type": "warp",
      "time_us": 103.7
    },
    "128": {
      "block_m": 32,
      "block_n": 64,
      "block_k": 128,
      "num_warps": 2,
      "num_stages": 1,
      "kernel_type": "warp",
      "time_us": 104.7
    },
    "256": {
      "block_m": 64,
      "block_n": 128,
      "block_k": 128,
      "num_warps": 2,
      "num_stages": 1,
      "kernel_type": "warp",
      "time_us": 110.3
    },
    "512": {
      "block_m": 64,
      "block_n": 128,
      "block_k": 128,
      "num_warps": 2,
      "num_stages": 1,
      "kernel_type": "warp",
      "time_us": 122.2
    },
    "1024": {
      "block_m": 128,
      "block_n": 256,
      "block_k": 128,
      "num_warps": 8,
      "num_stages": 2,
      "kernel_type": "wgmma",
      "time_us": 154.9
    },
    "1536": {
      "block_m": 128,
      "block_n": 256,
      "block_k": 128,
      "num_warps": 8,
      "num_stages": 2,
      "kernel_type": "wgmma",
      "time_us": 179.5
    },
    "2048": {
      "block_m": 128,
      "block_n": 256,
      "block_k": 128,
      "num_warps": 8,
      "num_stages": 2,
      "kernel_type": "wgmma",
      "time_us": 210.5
    },
    "3072": {
      "block_m": 128,
      "block_n": 256,
      "block_k": 64,
      "num_warps": 8,
      "num_stages": 3,
      "kernel_type": "wgmma",
      "time_us": 282.1
    },
    "4096": {
      "block_m": 128,
      "block_n": 256,
      "block_k": 64,
      "num_warps": 8,
      "num_stages": 3,
      "kernel_type": "wgmma",
      "time_us": 332.3
    }
  },
  "generated": "2026-01-07"
}
